{
  "schema_version": "1.0.0",
  "deliverable_id": "RES-STUDY-ABUSE-MISUSE-001",
  "validation_id": "VAL-READY-009",
  "status": "informative-draft",
  "researched_at": "2026-08-21",
  "methodology": [
    "Separate online signals available during one interaction, nearline signals available after short aggregation, and offline signals requiring longitudinal or external evidence.",
    "Treat signals as review leads, not findings. Every risk includes a plausible authorized-use twin and a false-positive path.",
    "Prefer public primary guidance from standards bodies, government agencies, protocol publishers, and service providers. Avoid operational detail that would enable abuse."
  ],
  "timing_definitions": {
    "online": "Available in the current request, response, tool call, session state, or authenticated runtime context and fast enough to inform a bounded real-time decision.",
    "nearline": "Available after minutes to hours of aggregation, enrichment, sandboxing, or cross-session comparison; it may inform containment or queued review but not the already completed interaction.",
    "offline": "Available through days-to-months longitudinal analysis, case investigation, external reports, evaluation, or adjudication."
  },
  "risks": [
    {
      "id": "cyber",
      "name": "Cyber abuse",
      "harm": "Model or agent use may support unauthorized access, malware activity, vulnerability exploitation, or disruptive operations.",
      "signals": {
        "online": [
          "Requests combine exploit intent with live-target context, credential material, or execution-capable tool calls.",
          "Tool results show unexpected privilege changes, outbound connections, or writes outside an authorized test boundary."
        ],
        "nearline": [
          "A short-window sequence progresses from reconnaissance to exploit adaptation to persistence across sessions or tools.",
          "Repeated attempts target many unrelated hosts or bypass earlier safeguards."
        ],
        "offline": [
          "Case correlation links activity to confirmed incidents, abuse reports, malware telemetry, or violated authorization boundaries.",
          "Longitudinal review finds coordinated infrastructure or recurring exploit chains."
        ]
      },
      "authorized_use_twins": [
        "A documented penetration test, capture-the-flag exercise, defensive reverse engineering, vulnerability reproduction, or incident-response investigation can produce the same technical vocabulary and tool sequence."
      ],
      "false_positive_factors": [
        "Code snippets and security terms do not establish malicious intent; scope, ownership, authorization, target, and execution context matter."
      ],
      "reviewer_path": {
        "triage_role": "Security-abuse analyst trained to distinguish defensive testing from unauthorized operations",
        "escalation_role": "Incident-response lead or product security owner with authority over the affected boundary",
        "evidence_requirements": [
          "Preserve the request/tool/result sequence, actor and tenant context, target indicators, stated authorization, detector version, and contradictory evidence."
        ],
        "appeal_route": "A separate reviewer rechecks scope and authorization; restoration or continued restriction records reasons and corrective evidence."
      },
      "limitations": [
        "Intent is rarely observable from one prompt, and sensitive incident context may be unavailable to the analyzer."
      ],
      "unresolved_questions": [
        "How can organizations attest test authorization without exposing sensitive network scope to an external analyzer?"
      ],
      "sources": [
        {
          "id": "ABUSE-SRC-CYBER-001",
          "publisher": "National Institute of Standards and Technology",
          "title": "Adversarial Machine Learning: A Taxonomy and Terminology of Attacks and Mitigations",
          "version_or_date": "NIST AI 100-2 E2025, March 2025",
          "source_url": "https://csrc.nist.gov/pubs/ai/100/2/e2025/final",
          "accessed_at": "2026-08-21",
          "claim_supported": "Security analysis needs explicit attack life-cycle, capability, knowledge, and objective distinctions rather than a keyword-only label."
        },
        {
          "id": "ABUSE-SRC-CYBER-002",
          "publisher": "MITRE",
          "title": "MITRE ATT&CK",
          "version_or_date": "Current knowledge base, accessed 2026-08-21",
          "source_url": "https://attack.mitre.org/",
          "accessed_at": "2026-08-21",
          "claim_supported": "Cyber behavior can be organized as tactics and techniques across an observed sequence, supporting staged rather than single-event review."
        }
      ]
    },
    {
      "id": "cbrn",
      "name": "Chemical, biological, radiological, and nuclear misuse",
      "harm": "Assistance could lower barriers to harmful acquisition, design, production, or deployment involving CBRN materials.",
      "signals": {
        "online": [
          "The interaction seeks harmful optimization, scale, acquisition, concealment, or deployment and combines it with operational context.",
          "Tool calls attempt to source restricted materials or validate hazardous procedures."
        ],
        "nearline": [
          "Multiple individually ambiguous questions compose into an end-to-end harmful workflow.",
          "The actor repeatedly reformulates requests to overcome safety boundaries or obtain missing operational steps."
        ],
        "offline": [
          "Qualified subject-matter review assesses whether the sequence materially increases harmful capability beyond public high-level knowledge.",
          "External threat intelligence or lawful reports provide context unavailable in the interaction."
        ]
      },
      "authorized_use_twins": [
        "Biosafety, emergency response, nonproliferation, public-health, academic, and industrial safety work can use the same entities and process terminology."
      ],
      "false_positive_factors": [
        "Technical specificity can reflect legitimate expertise; classification requires purpose, capability uplift, safeguards, and authorization, not topic alone."
      ],
      "reviewer_path": {
        "triage_role": "Specialist safety reviewer operating from minimized and compartmented evidence",
        "escalation_role": "Qualified CBRN subject-matter expert plus accountable safety authority",
        "evidence_requirements": [
          "Preserve the minimum necessary sequence, model outputs, tool actions, capability-uplift rationale, authorized context, and uncertainty without redistributing hazardous detail."
        ],
        "appeal_route": "Independent specialist review checks lawful research or safety context and can narrow, reverse, or sustain the decision with a recorded basis."
      },
      "limitations": [
        "General reviewers and language models can misjudge feasibility; handling detailed evidence can itself create safety and privacy risk."
      ],
      "unresolved_questions": [
        "What redacted evidence is sufficient for accountable appeal without spreading sensitive operational information?"
      ],
      "sources": [
        {
          "id": "ABUSE-SRC-CBRN-001",
          "publisher": "OpenAI",
          "title": "Preparedness Framework",
          "version_or_date": "Version 2, April 15, 2025",
          "source_url": "https://openai.com/index/updating-our-preparedness-framework/",
          "accessed_at": "2026-08-21",
          "claim_supported": "The framework treats biological/chemical capability as a tracked severe-harm category and uses safeguards reports and review rather than topic matching alone."
        },
        {
          "id": "ABUSE-SRC-CBRN-002",
          "publisher": "Anthropic",
          "title": "Responsible Scaling Policy",
          "version_or_date": "Version 2.2, May 14, 2025",
          "source_url": "https://www.anthropic.com/responsible-scaling-policy",
          "accessed_at": "2026-08-21",
          "claim_supported": "Anthropic separates capability thresholds, evaluations, safeguards, and governance for catastrophic biological and chemical risks."
        }
      ]
    },
    {
      "id": "fraud",
      "name": "Fraud and deception",
      "harm": "Generated content or agent actions may facilitate impersonation, payment diversion, identity theft, scams, or deceptive transactions.",
      "signals": {
        "online": [
          "Requests combine impersonation, urgency, secrecy, payment routing, identity artifacts, or evasion of verification.",
          "Agent actions alter payee, recovery, identity, or messaging fields without expected authorization evidence."
        ],
        "nearline": [
          "Templates or messages are sent at volume to unrelated recipients, or payment/recovery details change repeatedly.",
          "A cluster shares scripts, infrastructure, beneficiary details, or synthetic identities."
        ],
        "offline": [
          "Chargebacks, victim reports, verified impersonation, account investigations, or lawfully shared fraud intelligence corroborate harm.",
          "Longitudinal analysis links campaigns, mule accounts, or repeated social-engineering patterns."
        ]
      },
      "authorized_use_twins": [
        "Fraud simulation, brand-protection exercises, customer-support drafting, debt collection under policy, and authorized marketing can include urgency, financial terms, and message templates."
      ],
      "false_positive_factors": [
        "A payment request or persuasive tone alone is weak evidence; recipient consent, sender identity, transaction authority, and campaign context are needed."
      ],
      "reviewer_path": {
        "triage_role": "Fraud operations analyst with access to transaction and identity context under least privilege",